{
  "$schema": "http://json-schema.org/draft-07/schema#",
  "$id": "https://galaxyproject.org/foundry/schemas/summary-cwl.schema.json",
  "$comment": "Canonical source: packages/gxwf-foundry/src/schemas/summary-cwl/summary-cwl.schema.json in galaxyproject/foundry. Mold frontmatter cites this schema via [[summary-cwl]] wiki-links; the cast pipeline imports the `summaryCwlSchema` runtime export and serializes it into cast bundles.",
  "title": "CWL Workflow Summary",
  "description": "Structured per-source summary emitted by the summarize-cwl Mold. CWL is already a typed workflow language, so this schema records validated and normalized workflow/tool structure rather than inferred pipeline semantics.",
  "type": "object",
  "additionalProperties": false,
  "required": [
    "summary_version",
    "source",
    "documents",
    "workflow_inputs",
    "workflow_outputs",
    "steps",
    "tools",
    "graph",
    "tests",
    "warnings"
  ],
  "properties": {
    "summary_version": {
      "type": "string",
      "enum": [
        "1"
      ],
      "description": "Summary schema major version."
    },
    "source": {
      "$ref": "#/$defs/SourceRecord"
    },
    "documents": {
      "$ref": "#/$defs/DocumentSet"
    },
    "workflow_inputs": {
      "type": "array",
      "items": {
        "$ref": "#/$defs/WorkflowInput"
      }
    },
    "workflow_outputs": {
      "type": "array",
      "items": {
        "$ref": "#/$defs/WorkflowOutput"
      }
    },
    "steps": {
      "type": "array",
      "items": {
        "$ref": "#/$defs/WorkflowStep"
      }
    },
    "tools": {
      "type": "array",
      "items": {
        "$ref": "#/$defs/CommandLineTool"
      }
    },
    "graph": {
      "$ref": "#/$defs/WorkflowGraph"
    },
    "tests": {
      "type": "array",
      "items": {
        "$ref": "#/$defs/TestCase"
      }
    },
    "warnings": {
      "type": "array",
      "items": {
        "$ref": "#/$defs/Warning"
      }
    }
  },
  "$defs": {
    "SourceRecord": {
      "type": "object",
      "additionalProperties": false,
      "required": [
        "ecosystem",
        "workflow",
        "url",
        "version",
        "license",
        "slug",
        "cwl_version",
        "entrypoint"
      ],
      "properties": {
        "ecosystem": {
          "type": "string",
          "enum": [
            "cwl"
          ],
          "description": "Source ecosystem; fixed for this per-source schema."
        },
        "workflow": {
          "type": "string",
          "description": "Human-oriented workflow name, usually the entry Workflow id or source filename stem."
        },
        "url": {
          "type": [
            "string",
            "null"
          ],
          "description": "Original path or URL supplied by the user."
        },
        "version": {
          "type": [
            "string",
            "null"
          ],
          "description": "Pinned commit, tag, release, or digest when available."
        },
        "license": {
          "type": [
            "string",
            "null"
          ],
          "description": "License identifier or detected license filename when available."
        },
        "slug": {
          "type": "string",
          "description": "Stable kebab-case run slug."
        },
        "cwl_version": {
          "type": [
            "string",
            "null"
          ],
          "description": "Declared cwlVersion after loading the entry document, commonly v1.0, v1.1, or v1.2."
        },
        "entrypoint": {
          "type": "string",
          "description": "Main workflow document/id after resolution, e.g. workflow.cwl#main."
        }
      }
    },
    "DocumentSet": {
      "type": "object",
      "additionalProperties": false,
      "required": [
        "entrypoint",
        "normalized_path",
        "validation"
      ],
      "properties": {
        "entrypoint": {
          "type": "string",
          "description": "Local path or URL passed to cwl-utils/cwltool."
        },
        "normalized_path": {
          "type": [
            "string",
            "null"
          ],
          "description": "Path to the cwl-utils cwl-normalizer JSON output when normalization was requested or possible."
        },
        "validation": {
          "$ref": "#/$defs/ValidationResult"
        }
      }
    },
    "ValidationResult": {
      "type": "object",
      "additionalProperties": false,
      "required": [
        "command",
        "status",
        "diagnostics"
      ],
      "properties": {
        "command": {
          "type": "string",
          "description": "Validation command or library operation used."
        },
        "status": {
          "type": "string",
          "enum": [
            "valid",
            "warning",
            "invalid",
            "not-run"
          ]
        },
        "diagnostics": {
          "type": "array",
          "items": {
            "type": "string"
          }
        }
      }
    },
    "WorkflowInput": {
      "type": "object",
      "additionalProperties": false,
      "required": [
        "id",
        "label",
        "type",
        "optional",
        "default",
        "doc",
        "format",
        "secondary_files"
      ],
      "properties": {
        "id": {
          "type": "string"
        },
        "label": {
          "type": [
            "string",
            "null"
          ]
        },
        "type": {
          "type": "string",
          "description": "Compact CWL type expression, preserving arrays, records, enums, nullability, File, and Directory."
        },
        "optional": {
          "type": "boolean"
        },
        "default": {
          "description": "Verbatim default value when present.",
          "type": [
            "string",
            "number",
            "integer",
            "boolean",
            "object",
            "array",
            "null"
          ]
        },
        "doc": {
          "type": [
            "string",
            "null"
          ]
        },
        "format": {
          "type": [
            "string",
            "array",
            "null"
          ],
          "items": {
            "type": "string"
          }
        },
        "secondary_files": {
          "type": "array",
          "items": {
            "type": "string"
          }
        }
      }
    },
    "WorkflowOutput": {
      "type": "object",
      "additionalProperties": false,
      "required": [
        "id",
        "label",
        "type",
        "output_source",
        "doc",
        "format",
        "secondary_files"
      ],
      "properties": {
        "id": {
          "type": "string"
        },
        "label": {
          "type": [
            "string",
            "null"
          ]
        },
        "type": {
          "type": "string"
        },
        "output_source": {
          "type": [
            "string",
            "array",
            "null"
          ],
          "items": {
            "type": "string"
          }
        },
        "doc": {
          "type": [
            "string",
            "null"
          ]
        },
        "format": {
          "type": [
            "string",
            "array",
            "null"
          ],
          "items": {
            "type": "string"
          }
        },
        "secondary_files": {
          "type": "array",
          "items": {
            "type": "string"
          }
        }
      }
    },
    "WorkflowStep": {
      "type": "object",
      "additionalProperties": false,
      "required": [
        "id",
        "run",
        "run_class",
        "label",
        "doc",
        "in",
        "out",
        "scatter",
        "scatter_method",
        "when",
        "requirements",
        "hints"
      ],
      "properties": {
        "id": {
          "type": "string"
        },
        "run": {
          "type": "string",
          "description": "Resolved run reference as it appears in the normalized document, e.g. #tool_id."
        },
        "run_class": {
          "type": "string",
          "enum": [
            "CommandLineTool",
            "ExpressionTool",
            "Workflow",
            "Operation",
            "unknown"
          ]
        },
        "label": {
          "type": [
            "string",
            "null"
          ]
        },
        "doc": {
          "type": [
            "string",
            "null"
          ]
        },
        "in": {
          "type": "array",
          "items": {
            "$ref": "#/$defs/StepInput"
          }
        },
        "out": {
          "type": "array",
          "items": {
            "type": "string"
          }
        },
        "scatter": {
          "type": "array",
          "items": {
            "type": "string"
          }
        },
        "scatter_method": {
          "type": [
            "string",
            "null"
          ],
          "enum": [
            "dotproduct",
            "nested_crossproduct",
            "flat_crossproduct",
            null
          ]
        },
        "when": {
          "type": [
            "string",
            "null"
          ],
          "description": "CWL v1.2 conditional expression, preserved verbatim when present."
        },
        "requirements": {
          "type": "array",
          "items": {
            "$ref": "#/$defs/Requirement"
          }
        },
        "hints": {
          "type": "array",
          "items": {
            "$ref": "#/$defs/Requirement"
          }
        }
      }
    },
    "StepInput": {
      "type": "object",
      "additionalProperties": false,
      "required": [
        "id",
        "source",
        "default",
        "value_from",
        "link_merge",
        "pick_value"
      ],
      "properties": {
        "id": {
          "type": "string"
        },
        "source": {
          "type": [
            "array",
            "null"
          ],
          "description": "Normalized CWL source links. Null means the input has no source and is driven by default or runtime binding.",
          "items": {
            "type": "string"
          }
        },
        "default": {
          "description": "Verbatim WorkflowStepInput default value when present.",
          "type": [
            "string",
            "number",
            "integer",
            "boolean",
            "object",
            "array",
            "null"
          ]
        },
        "value_from": {
          "type": [
            "string",
            "null"
          ],
          "description": "Expression from valueFrom, preserved verbatim when present."
        },
        "link_merge": {
          "type": [
            "string",
            "null"
          ],
          "enum": [
            "merge_nested",
            "merge_flattened",
            null
          ],
          "description": "CWL linkMerge setting for multiple inbound sources."
        },
        "pick_value": {
          "type": [
            "string",
            "null"
          ],
          "enum": [
            "first_non_null",
            "the_only_non_null",
            "all_non_null",
            null
          ],
          "description": "CWL pickValue setting for choosing non-null values among multiple sources."
        }
      }
    },
    "CommandLineTool": {
      "type": "object",
      "additionalProperties": false,
      "required": [
        "id",
        "label",
        "base_command",
        "arguments",
        "inputs",
        "outputs",
        "requirements",
        "hints"
      ],
      "properties": {
        "id": {
          "type": "string"
        },
        "label": {
          "type": [
            "string",
            "null"
          ]
        },
        "base_command": {
          "type": "array",
          "items": {
            "type": "string"
          }
        },
        "arguments": {
          "type": "array",
          "items": {
            "type": "string"
          }
        },
        "inputs": {
          "type": "array",
          "items": {
            "$ref": "#/$defs/ToolInput"
          }
        },
        "outputs": {
          "type": "array",
          "items": {
            "$ref": "#/$defs/ToolOutput"
          }
        },
        "requirements": {
          "type": "array",
          "items": {
            "$ref": "#/$defs/Requirement"
          }
        },
        "hints": {
          "type": "array",
          "items": {
            "$ref": "#/$defs/Requirement"
          }
        }
      }
    },
    "ToolInput": {
      "type": "object",
      "additionalProperties": false,
      "required": [
        "id",
        "type",
        "input_binding",
        "doc",
        "format",
        "secondary_files"
      ],
      "properties": {
        "id": {
          "type": "string"
        },
        "type": {
          "type": "string"
        },
        "input_binding": {
          "$ref": "#/$defs/BindingSummary"
        },
        "doc": {
          "type": [
            "string",
            "null"
          ]
        },
        "format": {
          "type": [
            "string",
            "array",
            "null"
          ],
          "items": {
            "type": "string"
          }
        },
        "secondary_files": {
          "type": "array",
          "items": {
            "type": "string"
          }
        }
      }
    },
    "ToolOutput": {
      "type": "object",
      "additionalProperties": false,
      "required": [
        "id",
        "type",
        "output_binding",
        "doc",
        "format",
        "secondary_files"
      ],
      "properties": {
        "id": {
          "type": "string"
        },
        "type": {
          "type": "string"
        },
        "output_binding": {
          "$ref": "#/$defs/BindingSummary"
        },
        "doc": {
          "type": [
            "string",
            "null"
          ]
        },
        "format": {
          "type": [
            "string",
            "array",
            "null"
          ],
          "items": {
            "type": "string"
          }
        },
        "secondary_files": {
          "type": "array",
          "items": {
            "type": "string"
          }
        }
      }
    },
    "BindingSummary": {
      "type": [
        "object",
        "null"
      ],
      "additionalProperties": false,
      "required": [
        "position",
        "prefix",
        "glob",
        "value_from"
      ],
      "properties": {
        "position": {
          "type": [
            "number",
            "integer",
            "null"
          ]
        },
        "prefix": {
          "type": [
            "string",
            "null"
          ]
        },
        "glob": {
          "type": [
            "string",
            "array",
            "null"
          ],
          "items": {
            "type": "string"
          }
        },
        "value_from": {
          "type": [
            "string",
            "null"
          ]
        }
      }
    },
    "Requirement": {
      "type": "object",
      "additionalProperties": false,
      "required": [
        "class",
        "docker_pull",
        "docker_image_id",
        "packages",
        "raw"
      ],
      "properties": {
        "class": {
          "type": "string",
          "description": "Requirement or hint class, e.g. DockerRequirement, SoftwareRequirement, ScatterFeatureRequirement."
        },
        "docker_pull": {
          "type": [
            "string",
            "null"
          ],
          "description": "DockerRequirement.dockerPull when present."
        },
        "docker_image_id": {
          "type": [
            "string",
            "null"
          ],
          "description": "DockerRequirement.dockerImageId when present."
        },
        "packages": {
          "type": "array",
          "description": "SoftwareRequirement packages as name/version/spec strings.",
          "items": {
            "type": "string"
          }
        },
        "raw": {
          "type": "object",
          "additionalProperties": true,
          "description": "Verbatim requirement/hint object for unsupported or target-specific fields."
        }
      }
    },
    "WorkflowGraph": {
      "type": "object",
      "additionalProperties": false,
      "required": [
        "nodes",
        "edges"
      ],
      "properties": {
        "nodes": {
          "type": "array",
          "items": {
            "$ref": "#/$defs/GraphNode"
          }
        },
        "edges": {
          "type": "array",
          "items": {
            "$ref": "#/$defs/GraphEdge"
          }
        }
      }
    },
    "GraphNode": {
      "type": "object",
      "additionalProperties": false,
      "required": [
        "id",
        "kind",
        "label"
      ],
      "properties": {
        "id": {
          "type": "string"
        },
        "kind": {
          "type": "string",
          "enum": [
            "workflow-input",
            "step",
            "workflow-output"
          ]
        },
        "label": {
          "type": [
            "string",
            "null"
          ]
        }
      }
    },
    "GraphEdge": {
      "type": "object",
      "additionalProperties": false,
      "required": [
        "from",
        "to",
        "via"
      ],
      "properties": {
        "from": {
          "type": "string"
        },
        "to": {
          "type": "string"
        },
        "via": {
          "type": "array",
          "description": "Shape-affecting CWL features on this edge, e.g. scatter, linkMerge, pickValue, valueFrom.",
          "items": {
            "type": "string"
          }
        }
      }
    },
    "TestCase": {
      "type": "object",
      "additionalProperties": false,
      "required": [
        "name",
        "job_path",
        "expected_outputs",
        "provenance"
      ],
      "properties": {
        "name": {
          "type": "string"
        },
        "job_path": {
          "type": [
            "string",
            "null"
          ]
        },
        "expected_outputs": {
          "type": "array",
          "items": {
            "$ref": "#/$defs/ExpectedOutputRef"
          }
        },
        "provenance": {
          "type": "string"
        }
      }
    },
    "ExpectedOutputRef": {
      "type": "object",
      "additionalProperties": false,
      "required": [
        "id",
        "path",
        "url",
        "filetype",
        "checksum",
        "assertions"
      ],
      "properties": {
        "id": {
          "type": "string"
        },
        "path": {
          "type": [
            "string",
            "null"
          ]
        },
        "url": {
          "type": [
            "string",
            "null"
          ]
        },
        "filetype": {
          "type": [
            "string",
            "null"
          ]
        },
        "checksum": {
          "type": [
            "string",
            "null"
          ]
        },
        "assertions": {
          "type": "array",
          "items": {
            "type": "string"
          }
        }
      }
    },
    "Warning": {
      "type": "object",
      "additionalProperties": false,
      "required": [
        "code",
        "message",
        "path"
      ],
      "properties": {
        "code": {
          "type": "string"
        },
        "message": {
          "type": "string"
        },
        "path": {
          "type": [
            "string",
            "null"
          ]
        }
      }
    }
  }
}
